gillmoremarine.com, Error: queryMx ENOTFOUND gillmoremarine.com
,fireupthefurnace.com, Error: queryMx ENODATA fireupthefurnace.com
,tfta.com, Error: queryMx ENODATA tfta.com
,whitefoxllc.com, Error: queryMx ENODATA whitefoxllc.com
,continuityexpress.com, Error: queryMx ENOTFOUND continuityexpress.com
,erichome.com, Error: queryMx ENODATA erichome.com
,desjardinslandscaping.com, Error: queryMx ENOTFOUND desjardinslandscaping.com
,metwire.com, No mx records found.
,hoyt-costello.com, Error: queryMx ENOTFOUND hoyt-costello.com
,mustang2000.com, Error: queryMx ENOTFOUND mustang2000.com
,, Error: queryMx ENODATA
,sildis.com, Error: queryMx ENODATA sildis.com
,sullivan-and-company.com, Error: queryMx ENOTFOUND sullivan-and-company.com
,whitefoxcustombuilders.com, Error: queryMx ENOTFOUND whitefoxcustombuilders.com
,bigbrainnetworks.com, IP ERROR: Error: queryA ENOTFOUND mail.bigbrainnetworks.com
,yourhomestock.com, IP ERROR: Error: queryA ENOTFOUND d39294b.ess.barracudanetworks.com.yourhomestock.com
,corporatedesigninsurance.com, IP ERROR: Error: queryA ENOTFOUND corporatedesigninsurance.com.mx1.broadviewnet.rcimx.net
,crownconfirmations.com, Error: queryMx ESERVFAIL crownconfirmations.com
